{
  "paperId": "arxiv-2304.02643",
  "readingMinutes": 8,
  "sourceVersion": "arXiv v1",
  "sourceSections": [
    "§2–§8",
    "Appendices A–G"
  ],
  "takeaways": [
    "SAM 的核心不是多一个分割模型，而是把分割改造成可提示的通用接口。",
    "真正形成壁垒的是模型、数据引擎和 11 亿掩码数据集彼此增强的闭环。",
    "现成权重容易使用；从头复现训练和 SA-1B 数据闭环几乎是另一件事。"
  ],
  "dimensions": [
    {
      "id": 1,
      "label": "标题",
      "summary": "“Segment Anything”表达的是能力边界：用户指出什么，模型就尝试分出什么。",
      "bullets": [
        "中文可理解为“分割一切”，但它不是保证任何目标都能完美分割。",
        "标题中的 Anything 强调开放提示和跨分布迁移，而不是固定类别预测。"
      ]
    },
    {
      "id": 2,
      "label": "机构与作者",
      "summary": "Meta AI Research 的 12 人团队同时覆盖模型、数据引擎、标注和责任评估。",
      "bullets": [
        "作者阵容包含长期从事检测、分割和视觉基础模型的研究者。",
        "论文贡献不是单一网络结构，而是一套模型—数据—工具联合工程。"
      ]
    },
    {
      "id": 3,
      "label": "发布日期",
      "summary": "首个 arXiv 版本发布于 2023-04-05。",
      "bullets": [
        "本页按 arXiv v1 全文核对。",
        "它代表初代图像版 SAM；后续视频版 SAM 2 不属于本文结论。"
      ]
    },
    {
      "id": 4,
      "label": "任务",
      "summary": "输入图像和提示，输出与提示相符的一个或多个像素级掩码。",
      "bullets": [
        "提示可以是前景/背景点、框、已有掩码，文本提示只做了早期验证。",
        "一处点击可能对应物体、部件或子部件，因此模型允许输出 3 个候选掩码。"
      ],
      "visual": {
        "kind": "figure",
        "src": "papers/arxiv-2304.02643/original/figure-1.webp",
        "label": "原论文 Figure 1",
        "pdfPage": 1,
        "alt": "Segment Anything 原论文图 1：任务、SAM 模型和数据引擎三部分",
        "caption": "整篇论文的主线不是单个模型，而是 task、model、data 三部分互相驱动。",
        "explanation": [
          "左：点、框、掩码或文本都可以成为提示，输出必须是一个有效掩码。",
          "中：图像编码器负责重计算，提示编码器与轻量解码器负责快速交互。",
          "右：模型辅助标注数据，更多数据再反过来训练模型，形成闭环。"
        ]
      }
    },
    {
      "id": 5,
      "label": "应用场景",
      "summary": "最适合做“通用分割底座”，而不是直接替代所有领域专用模型。",
      "bullets": [
        "交互抠图：少量点击快速得到可编辑区域。",
        "数据标注：模型先产掩码，人工只修正难例。",
        "系统组合：接收检测框、视线点或其他模型输出，成为视觉工作流的一环。"
      ]
    },
    {
      "id": 6,
      "label": "解决的问题",
      "summary": "传统分割模型把类别、数据集和任务绑死，换场景就要重新标注和训练。",
      "bullets": [
        "像素级标注昂贵，互联网又没有天然存在的大规模掩码。",
        "单一类别头无法表达“这个物体”“这件衣服”或“框里的区域”等临时意图。",
        "SAM 用统一提示接口降低换任务成本，再用数据引擎解决数据不足。"
      ],
      "visual": {
        "kind": "figure",
        "src": "papers/arxiv-2304.02643/original/figure-3.webp",
        "label": "原论文 Figure 3",
        "pdfPage": 4,
        "alt": "Segment Anything 原论文图 3：同一点提示对应三个合理掩码",
        "caption": "一个点可能指向整体、部件或子部件，因此 SAM 直接输出多个候选，而不是强迫唯一答案。",
        "explanation": [
          "每一列只给一个绿色点，模型仍返回三个语义层级不同的掩码。",
          "训练时只反向传播候选中损失最小的掩码，避免把歧义硬压成单一标注。",
          "同时预测 IoU 分数，用于推理时给候选排序。"
        ]
      }
    },
    {
      "id": 7,
      "label": "核心方法",
      "summary": "把任务、模型和数据引擎设计成闭环：模型帮助产数据，更多数据再反哺模型。",
      "bullets": [
        "任务层：定义可提示分割，使预训练和零样本迁移使用同一种交互。",
        "模型层：重图像编码、轻提示解码，让同一图像上的连续交互很快。",
        "数据层：从人工辅助逐步过渡到全自动生成，扩展到 SA-1B。"
      ],
      "visual": {
        "kind": "figure",
        "src": "papers/arxiv-2304.02643/original/figure-4.webp",
        "label": "原论文 Figure 4",
        "pdfPage": 5,
        "alt": "Segment Anything 原论文图 4：SAM 总体结构",
        "caption": "先把图像压成可复用的 embedding，再让不同提示查询同一份视觉表示。",
        "explanation": [
          "Image encoder 对整张图运行一次，是最重的部分。",
          "Prompt encoder 把点、框、掩码或文本转成提示向量。",
          "Mask decoder 融合图像与提示，输出 3 个候选掩码及其质量分数。"
        ]
      }
    },
    {
      "id": 8,
      "label": "模型结构",
      "summary": "ViT-H 先把图像压成共享特征；提示编码器和轻量解码器只处理交互变化。",
      "bullets": [
        "图像编码器：MAE 预训练的 ViT-H/16，输出 16× 下采样图像嵌入。",
        "提示编码器：点和框用位置编码，掩码用卷积编码。",
        "掩码解码器：双向交叉注意力融合提示与图像，输出 3 个掩码和质量分数。"
      ],
      "visual": {
        "kind": "figure",
        "src": "papers/arxiv-2304.02643/original/figure-14.webp",
        "label": "原论文 Figure 14",
        "pdfPage": 16,
        "alt": "Segment Anything 原论文图 14：轻量掩码解码器细节",
        "caption": "两层双向 Transformer 让提示 token 与图像 embedding 相互更新，再动态生成掩码。",
        "explanation": [
          "Token→image attention：提示去图像中寻找相关区域。",
          "Image→token attention：图像特征反过来吸收提示信息。",
          "输出 token 生成逐像素分类器，同时给出每个候选的 IoU 估计。"
        ]
      }
    },
    {
      "id": 9,
      "label": "训练策略",
      "summary": "训练时模拟真实交互：模型出错后继续给点，共进行 11 轮提示。",
      "bullets": [
        "损失由 focal loss 与 dice loss 相加，兼顾像素不平衡和区域重叠。",
        "遇到歧义时只反传 3 个候选中损失最小的掩码，避免强迫唯一答案。",
        "默认只用全自动掩码训练；使用全部阶段数据仅约高 0.5 mIoU。"
      ]
    },
    {
      "id": 10,
      "label": "数据配方",
      "summary": "SA-1B 用 1100 万张授权且做隐私处理的图像，生成 11 亿个掩码。",
      "bullets": [
        "99.1% 掩码来自全自动阶段，公开集只保留自动掩码。",
        "人脸和车牌在发布图像中被模糊。",
        "规模提高了覆盖面，但并不代表所有行业分布都被充分包含。"
      ],
      "visual": {
        "kind": "figure",
        "src": "papers/arxiv-2304.02643/original/figure-6.webp",
        "label": "原论文 Figure 6",
        "pdfPage": 7,
        "alt": "Segment Anything 原论文图 6：SA-1B 与既有分割数据集的掩码属性",
        "caption": "SA-1B 的优势首先是覆盖量，而不是所有统计分布都与真实世界完全一致。",
        "explanation": [
          "左图：每张图的掩码数量远高于既有数据集。",
          "中图：大规模自动生成带来了更多小掩码。",
          "右图：形状凹度分布与其他数据集大体接近。"
        ]
      }
    },
    {
      "id": 11,
      "label": "训练集与测试集",
      "summary": "训练只依赖 SA-1B；测试刻意跨越 23 个分布和多类下游任务。",
      "bullets": [
        "训练：SA-1B 最终全自动掩码，默认 1100 万图。",
        "提示分割：23 个数据集，覆盖自然图、遥感、显微、仿真、水下等分布。",
        "迁移评估：BSDS500、LVIS、COCO 等；不使用这些任务的针对性训练。"
      ]
    },
    {
      "id": 12,
      "label": "主要指标",
      "summary": "SAM 的强项是跨任务零样本可用，不是每项指标都超过专用监督模型。",
      "bullets": [
        "单点提示：23 个数据集中 16 个优于强交互基线 RITM。",
        "LVIS 目标提议：59.3 AR@1000，接近监督 ViTDet-H 的 63.0。",
        "实例分割：用检测框提示得到 46.5 AP，低于监督 ViTDet-H 的 51.0。"
      ],
      "visual": {
        "kind": "figure",
        "src": "papers/arxiv-2304.02643/original/figure-9.webp",
        "label": "原论文 Figure 9",
        "pdfPage": 9,
        "alt": "Segment Anything 原论文图 9：23 个数据集上的点提示评估",
        "caption": "SAM 的强项是跨域与少提示交互；单点自动 mIoU 会被任务本身的歧义拉低。",
        "explanation": [
          "左：相对 RITM，SAM 在多数数据集上更好，但并非全部。",
          "右上：人工评价普遍更认可 SAM 的掩码质量。",
          "右下：提示点增多后，SAM 与交互分割基线的差距缩小。"
        ]
      }
    },
    {
      "id": 13,
      "label": "相对上一代方法的变化",
      "summary": "它把“为数据集训练一个模型”变成“预训练一次，再用提示定义任务”。",
      "bullets": [
        "交互分割方法通常只优化点击修正；SAM 同时服务自动标注和零样本迁移。",
        "传统类别分割输出固定标签；SAM 输出由当前提示指定的区域。",
        "图像嵌入可复用，使交互延迟主要落在轻量解码器。"
      ],
      "visual": {
        "kind": "table",
        "src": "papers/arxiv-2304.02643/original/table-4.webp",
        "label": "原论文 Table 4",
        "pdfPage": 10,
        "alt": "Segment Anything 原论文表 4：LVIS 零样本候选区域生成",
        "caption": "SAM 没见过 LVIS 标注，却在中、大、常见和稀有目标上接近或超过专用检测器。",
        "explanation": [
          "总体 AR@1000：SAM 59.3，监督 ViTDet-H 为 63.0。",
          "稀有类别：SAM 65.8，高于 ViTDet-H 的 58.3。",
          "小目标仍明显落后，说明零样本能力不是全面替代专用训练。"
        ]
      }
    },
    {
      "id": 14,
      "label": "真正有价值的创新",
      "summary": "最有价值的是可组合接口和数据闭环，而不是某个单独模块。",
      "bullets": [
        "接口创新：点、框、掩码统一成可调用的分割 API。",
        "歧义建模：同一提示输出多个合理答案，符合真实对象层级。",
        "数据创新：模型效率直接转化为标注效率，标注效率再转化为数据规模。"
      ],
      "visual": {
        "kind": "table",
        "src": "papers/arxiv-2304.02643/original/table-5.webp",
        "label": "原论文 Table 5",
        "pdfPage": 11,
        "alt": "Segment Anything 原论文表 5：零样本实例分割",
        "caption": "把 SAM 接在检测框之后可以直接工作，但自动 AP 仍低于全监督 ViTDet。",
        "explanation": [
          "COCO AP：SAM 46.5，对比 ViTDet-H 的 51.0。",
          "LVIS AP：SAM 44.7，对比 ViTDet-H 的 46.6。",
          "价值在通用组合能力和掩码质量，不在所有自动指标上夺冠。"
        ]
      }
    },
    {
      "id": 15,
      "label": "是否开源以及开源地址",
      "summary": "模型代码与权重以 Apache 2.0 开放；SA-1B 按单独研究许可提供。",
      "bullets": [
        "官方代码支持点、框、掩码提示以及自动掩码生成。",
        "模型许可与数据许可不同，商业使用前必须分别检查。",
        "官方入口：github.com/facebookresearch/segment-anything。"
      ]
    },
    {
      "id": 16,
      "label": "代码成熟度",
      "summary": "推理与集成成熟，完整训练复现并不是仓库的主要目标。",
      "bullets": [
        "提供模型注册、权重、Notebook、ONNX 导出和自动掩码生成。",
        "生态中已有大量封装与下游组合，接口稳定。",
        "训练数据引擎、标注平台和全部生产流程没有完整开源。"
      ]
    },
    {
      "id": 17,
      "label": "复现难度",
      "summary": "使用权重是低到中等难度；复现论文训练是极高难度。",
      "bullets": [
        "推理：准备 GPU、权重和简单提示即可。",
        "评测：需按论文提示采样和多数据集协议复现。",
        "训练：需要 SA-1B 级数据、256 GPU 训练和人机标注系统。"
      ]
    },
    {
      "id": 18,
      "label": "算力需求",
      "summary": "重图像编码器决定首次延迟；大规模训练远超普通团队预算。",
      "bullets": [
        "论文默认 ViT-H、1024×1024 输入、总 batch 256。",
        "从头训练分布在 256 张 GPU 上。",
        "更小 ViT-B/L 权重更适合边缘或吞吐敏感场景，ViT-H 相对 ViT-L 收益已趋于饱和。"
      ]
    },
    {
      "id": 19,
      "label": "工业落地价值",
      "summary": "高：它最适合成为标注、编辑和感知系统中的通用区域提取器。",
      "bullets": [
        "减少为每个目标单独训练像素级模型的前期成本。",
        "与检测器组合可形成“文本找框 + SAM 出掩码”的自动标注链路。",
        "落地前仍需验证小目标、边界精度、领域偏移和端到端延迟。"
      ]
    },
    {
      "id": 20,
      "label": "商业价值判断",
      "summary": "价值主要来自缩短标注和产品迭代周期，而不是直接出售一个分割指标。",
      "bullets": [
        "可沉淀为图像编辑、工业质检、内容理解等产品的公共能力。",
        "通用模型减少长尾定制，但无法免除领域验收和人工兜底。",
        "护城河更可能在专有数据闭环、交互体验和下游系统，而非公开权重本身。"
      ]
    },
    {
      "id": 21,
      "label": "局限",
      "summary": "它追求广度而非每个场景的极致精度。",
      "bullets": [
        "细结构、锐利边界、小目标和分离区域可能出错。",
        "多点高精度交互中，专用交互分割器可能更强。",
        "完整流程不一定实时；文本提示能力也不成熟。",
        "公平性检查有限，不能外推为所有人群和应用都安全。"
      ]
    },
    {
      "id": 22,
      "label": "后续值得关注的问题",
      "summary": "下一步应围绕速度、领域适配和组合系统中的误差传播展开。",
      "bullets": [
        "更轻编码器能否在明显降算力时保住小目标和边界质量？",
        "医疗、遥感、制造等领域需要怎样的轻量适配？",
        "检测器、跟踪器或多模态模型给错提示时，SAM 如何识别并拒绝？",
        "数据许可、隐私处理和偏差评估如何随行业要求升级？"
      ]
    }
  ]
}
